{
  "$schema": "./cases.schema.json",
  "contract": "partner-docs-retrieval-v1",
  "authoredAt": "2026-07-09",
  "note": "Hand-authored retrieval cases for todo 910 / issue #18. This is a diagnostic spike lane, not a headline QA gate and not a production routing map. The eight `page-derived` cases are the 2026-07-09 cohort; the four independent paraphrase/negative/conflict cases added 2026-07-31 are the ones the phase-1 ship gate counts.",
  "cases": [
    {
      "id": "alchemy-stellar-data-overview",
      "partner": "alchemy",
      "caseType": "page-derived",
      "question": "Is Alchemy's Stellar Data API live, what data does it index, and how does pagination work?",
      "baseline": [
        { "type": "operation", "id": "stellarDocs.search_rpc_horizon_data_docs" },
        { "type": "operation", "id": "scout.searchResearch" }
      ],
      "candidateUrls": [
        "https://www.alchemy.com/docs/reference/stellar-data-api-overview.md"
      ],
      "facts": [
        ["Stellar Data API"],
        ["native", "XLM"],
        ["classic", "trustline"],
        ["Soroban"],
        ["transfer history"],
        ["account balances"],
        ["NFT holdings"],
        ["opaque pageKey", "pageKey cursors"]
      ]
    },
    {
      "id": "alchemy-stellar-transfers",
      "partner": "alchemy",
      "caseType": "page-derived",
      "question": "How do I query Alchemy for Stellar transfer history across native, classic, and Soroban assets?",
      "baseline": [
        { "type": "operation", "id": "stellarDocs.search_rpc_horizon_data_docs" },
        { "type": "operation", "id": "scout.searchResearch" }
      ],
      "candidateUrls": [
        "https://www.alchemy.com/docs/data/stellar-data-api/stellar-data-api-endpoints/transfers/get-stellar-transfers.md"
      ],
      "facts": [
        ["POST"],
        ["/data/stellar/transfers"],
        ["transferType"],
        ["native"],
        ["classic"],
        ["soroban"],
        ["pageKey"],
        ["fromLedger", "toLedger"]
      ]
    },
    {
      "id": "alchemy-stellar-balances",
      "partner": "alchemy",
      "caseType": "page-derived",
      "question": "How does Alchemy's Stellar balances endpoint combine XLM, trustline assets, and Soroban tokens?",
      "baseline": [
        { "type": "operation", "id": "stellarDocs.search_rpc_horizon_data_docs" },
        { "type": "operation", "id": "scout.searchResearch" }
      ],
      "candidateUrls": [
        "https://www.alchemy.com/docs/data/stellar-data-api/stellar-data-api-endpoints/balances/get-stellar-balances.md"
      ],
      "facts": [
        ["POST"],
        ["/data/stellar/balances"],
        ["native XLM"],
        ["classic trustline", "classic"],
        ["Soroban contract tokens", "soroban"],
        ["first page"],
        ["opaque pagination cursor", "pageKey"],
        ["data envelope", "results under a data envelope"]
      ]
    },
    {
      "id": "alchemy-stellar-rpc-quickstart",
      "partner": "alchemy",
      "caseType": "page-derived",
      "question": "What is the first JSON-RPC request for Alchemy's Stellar RPC and what endpoint does it use?",
      "baseline": [
        { "type": "operation", "id": "stellarDocs.search_docs" },
        { "type": "operation", "id": "scout.searchResearch" }
      ],
      "candidateUrls": [
        "https://www.alchemy.com/docs/reference/stellar-api-quickstart.md"
      ],
      "facts": [
        ["stellar-mainnet.g.alchemy.com"],
        ["/v2/"],
        ["getNetwork"],
        ["JSON-RPC 2.0", "jsonrpc"],
        ["apiKey", "API key"],
        ["named parameters"],
        ["getLatestLedger"],
        ["getLedgerEntries"]
      ]
    },
    {
      "id": "openzeppelin-stellar-suite",
      "partner": "openzeppelin",
      "caseType": "page-derived",
      "question": "What is in the current OpenZeppelin Stellar smart-contract suite?",
      "baseline": [
        { "type": "skill", "id": "skills.openzeppelin-stellar.setup-stellar-contracts" }
      ],
      "candidateUrls": [
        "https://raw.githubusercontent.com/OpenZeppelin/docs/f304ed55579dedf7ee0d2cc46982cca67c48e700/content/stellar-contracts/index.mdx"
      ],
      "facts": [
        ["Smart Account"],
        ["Fungible Tokens"],
        ["Non-Fungible Tokens", "NFTs"],
        ["Real World Assets", "RWAs"],
        ["Governor"],
        ["Timelock Controller"],
        ["Fee Abstraction"],
        ["USDC"]
      ]
    },
    {
      "id": "openzeppelin-smart-account",
      "partner": "openzeppelin",
      "caseType": "page-derived",
      "question": "How do OpenZeppelin Stellar smart accounts compose context rules, signers, verifiers, and policies?",
      "baseline": [
        { "type": "skill", "id": "skills.openzeppelin-stellar.setup-stellar-contracts" }
      ],
      "candidateUrls": [
        "https://raw.githubusercontent.com/OpenZeppelin/docs/f304ed55579dedf7ee0d2cc46982cca67c48e700/content/stellar-contracts/accounts/smart-account.mdx"
      ],
      "facts": [
        ["CustomAccountInterface"],
        ["context rules"],
        ["signers"],
        ["policies"],
        ["verifiers"],
        ["Protocol 23"],
        ["AuthPayload"],
        ["authorization flow", "Rule Evaluation"]
      ]
    },
    {
      "id": "openzeppelin-stellar-rwa",
      "partner": "openzeppelin",
      "caseType": "page-derived",
      "question": "How does OpenZeppelin's Stellar RWA suite implement regulated security tokens and identity checks?",
      "baseline": [
        { "type": "skill", "id": "skills.openzeppelin-stellar.develop-secure-contracts" }
      ],
      "candidateUrls": [
        "https://raw.githubusercontent.com/OpenZeppelin/docs/f304ed55579dedf7ee0d2cc46982cca67c48e700/content/stellar-contracts/tokens/rwa/rwa.mdx"
      ],
      "facts": [
        ["T-REX"],
        ["KYC/AML", "KYC", "AML"],
        ["identity verifier"],
        ["compliance contract"],
        ["forced transfer"],
        ["balance recovery", "recover_balance"],
        ["identity registry storage"],
        ["claim topics", "trusted issuer"]
      ]
    },
    {
      "id": "openzeppelin-stellar-relayer",
      "partner": "openzeppelin",
      "caseType": "page-derived",
      "question": "What do the current OpenZeppelin Relayer docs say about Stellar sponsored transactions and fee-token policy?",
      "baseline": [
        { "type": "operation", "id": "stellarDocs.search_sdk_cli_tools_docs" }
      ],
      "candidateUrls": [
        "https://raw.githubusercontent.com/OpenZeppelin/docs/f304ed55579dedf7ee0d2cc46982cca67c48e700/content/relayer/1.4.x/stellar.mdx"
      ],
      "facts": [
        ["mainnet"],
        ["testnet"],
        ["sponsored transactions"],
        ["fee_payment_strategy"],
        ["allowed_tokens"],
        ["classic Stellar assets", "credit_alphanum4"],
        ["Soroban token support will be available", "future release"],
        ["concurrent_transactions"]
      ]
    },
    {
      "id": "alchemy-stellar-nfts-filter-exclusivity",
      "partner": "alchemy",
      "caseType": "negative",
      "addedAt": "2026-07-31",
      "provenance": "An API-usage constraint question, not a page summary: an agent writing a first integration naturally tries to narrow an NFT query by Soroban contract and classic asset at once. The correct answer is a refusal the partner documents and no Stellar-side source states.",
      "question": "Can one Alchemy Stellar NFT request filter by a Soroban contract id and a classic asset code at the same time, and what page size and cursor rules apply?",
      "baseline": [
        { "type": "operation", "id": "stellarDocs.search_rpc_horizon_data_docs" },
        { "type": "operation", "id": "scout.searchResearch" }
      ],
      "candidateUrls": [
        "https://www.alchemy.com/docs/data/stellar-data-api/stellar-data-api-endpoints/nf-ts/get-stellar-nfts.md"
      ],
      "facts": [
        ["/data/stellar/nfts"],
        ["mutually exclusive", "Setting both is rejected"],
        ["contractId"],
        ["assetIssuer"],
        ["asOfLedger"],
        ["Invalid pageKey"],
        ["Max holdings per page"],
        ["Bearer"]
      ]
    },
    {
      "id": "alchemy-data-api-versus-rpc-product-split",
      "partner": "alchemy",
      "caseType": "conflict",
      "addedAt": "2026-07-31",
      "provenance": "The conflation risk named in research/partner-doc-source-onboarding.md: Alchemy ships two distinct Stellar products. A source that blends them answers with the wrong host, auth scheme, and protocol. The case requires holding both apart.",
      "question": "Alchemy has both a Stellar RPC endpoint and a Stellar Data API — which one serves indexed history, and are they the same host and protocol?",
      "baseline": [
        { "type": "operation", "id": "stellarDocs.search_docs" },
        { "type": "operation", "id": "scout.searchResearch" }
      ],
      "candidateUrls": [
        "https://www.alchemy.com/docs/reference/stellar-data-api-overview.md",
        "https://www.alchemy.com/docs/data/stellar-data-api/stellar-data-api-endpoints/transfers/get-stellar-transfers.md",
        "https://www.alchemy.com/docs/reference/stellar-api-quickstart.md"
      ],
      "facts": [
        ["Looking for Stellar JSON-RPC methods instead"],
        ["api.g.alchemy.com"],
        ["stellar-mainnet.g.alchemy.com"],
        ["/v2/"],
        ["without running your own indexer"],
        ["getLatestLedger"],
        ["results under a data envelope", "data envelope"],
        ["pageKey"]
      ]
    },
    {
      "id": "openzeppelin-fee-abstraction-token-fees",
      "partner": "openzeppelin",
      "caseType": "paraphrase",
      "addedAt": "2026-07-31",
      "provenance": "A product-capability question phrased the way a dapp team asks it (\"can my users pay in USDC?\"), covering an OpenZeppelin package that none of the three mirrored skills document.",